{"candidateArtifact":"benchmarks/model-outputs/modular-v326-ab/knot-v326-inference-v6-repair-chain/inference-run.json","caseId":"knot-hopf-rt","entries":{"completeness":15,"correctness":21,"score":36},"format":{"jsonValidity":4,"referenceIntegrity":6,"score":10},"goldRevision":"v1","graphComparison":{"candidate":{"entryCount":47,"inferenceCount":7,"isolatedEntryCount":29,"isolatedEntryIds":["paper:calc:jones-writhe-normalization","paper:calc:quantum-trace-categorical","paper:def:blackboard-framing","paper:def:categorical-trace","paper:def:colored-framed-link","paper:def:colored-jones-polynomial","paper:def:colored-ribbon-graph","paper:def:drinfeld-element","paper:def:graphical-calculus","paper:def:hopf-link-matrix","paper:def:integer-surgery","paper:def:jones-polynomial","paper:def:modular-hop-algebra","paper:def:modular-hopf-algebra","paper:def:negligible-module","paper:def:operator-invariant-f","paper:def:purification","paper:def:quantum-dimension","paper:def:quantum-trace","paper:def:ribbon-category","paper:def:strict-monoidal-category","paper:def:weyl-alcove-simple-modules","paper:def:writhe-normalization","paper:def:wrt-invariant","paper:prop:generic-invariant-laurent","paper:prop:jones-from-basic-representation","paper:prop:root-of-unity-wrt","paper:thm:rohlin-cobordism","paper:thm:turaev-purification"],"isolatedEntryRatio":0.6170212765957447,"largestNontrivialComponentCoverage":0.1702127659574468,"largestNontrivialComponentSize":8,"nontrivialComponentCount":3},"gold":{"entryCount":37,"inferenceCount":19,"isolatedEntryCount":0,"isolatedEntryIds":[],"isolatedEntryRatio":0,"largestNontrivialComponentCoverage":1,"largestNontrivialComponentSize":37,"nontrivialComponentCount":1}},"incorrectEntries":["rt:entry:kirby-calculus：候选的关键 framing 文本被损坏为不可解释的“$\\u001771$-framed unknot”；其总证明虽另行写出 ±1 move，但该 Entry 本身不正确。","rt:entry:negligible-module：候选只完整定义 negligible module，遗漏 Gold 同一 Entry 中 negligible morphism 的量子迹判据。","rt:entry:purification：候选把“按 negligible morphisms 取商”的定义直接表述成必然得到 modular category，省略所需假设并混合了定义与纯化定理的结论。","候选 B₀ 角色过度指派：除四个 Gold B₀ 外，还把 generic Laurent、Jones 基本表示、root-of-unity WRT 与 Rohlin cobordism 等条目列为 B₀。"],"incorrectInferences":["rt:inference:normalization-cancels-blowup：候选 proof:7 声称 signature/rank 归一化抵消 ±1 move，但候选没有定义 Δ、D²=Σ_i dim(i)² 等 modular data，因而该关键抵消关系仅被断言而未由完整 premises 支持。"],"inferences":{"completeness":13,"correctness":23,"score":36},"matchedEntries":["rt:entry:surgery-manifold","rt:entry:lickorish-wallace","rt:entry:monoidal-category","rt:entry:braiding","rt:entry:duality","rt:entry:twist","rt:entry:ribbon-category","rt:entry:graphical-calculus","rt:entry:turaev-ribbon-graph-functor","rt:entry:colored-link-invariant","rt:entry:quasitriangular-hopf-algebra","rt:entry:ribbon-hopf-algebra","rt:entry:r-matrix-braiding","rt:entry:universal-twist","rt:entry:rep-ribbon","rt:entry:quantum-trace","rt:entry:finite-simple-system","rt:entry:hopf-link-matrix","rt:entry:modular-category","rt:entry:modular-hopf-algebra","rt:entry:turaev-purification-theorem","rt:entry:purified-category-modular","rt:entry:kirby-color","rt:entry:signature-normalization","rt:entry:kirby-presentation-independence","rt:entry:rt-invariant"],"matchedInferences":["rt:inference:geometry-to-kirby-reduction","rt:inference:graphical-calculus-to-link-invariant","rt:inference:hopf-to-monoidal","rt:inference:hopf-to-duality","rt:inference:r-matrix-to-braiding","rt:inference:ribbon-element-to-twist","rt:inference:assemble-rep-ribbon","rt:inference:kirby-color-to-slide","rt:inference:kirby-moves-to-presentation-independence","rt:inference:presentation-independence-to-rt"],"missingEntries":["rt:entry:framed-link","rt:entry:kirby-reduction","rt:entry:hopf-algebra","rt:entry:coproduct-monoidal","rt:entry:antipode-duality","rt:entry:modular-data","rt:entry:handle-slide-invariance","rt:entry:blowup-invariance"],"missingInferences":["rt:inference:organize-ribbon-category","rt:inference:organize-graphical-calculus","rt:inference:rep-ribbon-to-qtrace","rt:inference:organize-modular-category","rt:inference:apply-purification-theorem","rt:inference:organize-modular-data","rt:inference:organize-kirby-color","rt:inference:organize-signature-normalization"],"promptVersion":"sol-score-prompt-v3","schema":"cmath.paper-import-sol-score/v3","scorer":"gpt-5.6-sol","solScore":82,"summary":"候选 JSON 与 Project View 可解析，mainTarget、B₀ 和全部 inference 引用均指向现有 Entry；核心的 surgery、ribbon category、ribbon Hopf algebra、modular category、Kirby-color 求和、RT 归一化公式及最终不变量基本正确。两个高度压缩的证明也保留了 Rep_fd(A) 获得 ribbon 结构以及 RT 不变量经 handle slide、blow-up、Kirby calculus 和 surgery theorem 得出的主要方向。主要缺陷是遗漏基本 Hopf 代数定义、若干表示结构引理、完整 modular data（尤其 D 与 Δ）、量子迹桥接和 purification 应用链；Kirby calculus 的 ±1 framing 文本损坏，purification 定义过度断言，B₀ 亦明显过度指派。候选还加入 Gold 中没有的 Jones/WRT 支线，却没有把这些内容接入核心逻辑。结构上 Gold 的 37 个 Entry 由 19 条 inference 连成单一分量，而候选 47 个 Entry 中有 29 个孤立，最大非平凡分量仅覆盖 8 个 Entry；多个分量本身并非缺陷，部分孤立项也确属可独立存在的定义，但量子迹、purification、modular Hopf algebra 等关键桥接节点同样孤立，因此这里的碎片化具有实质意义。Gold 的 inference 结构并不薄弱，不过图指标仍只能辅助定位遗漏，不能单独证明语义不完整。","verdict":"needs-revision"}