{"candidateArtifact":"benchmarks/model-outputs/fixed-1.1/knot-hopf-rt-v3.41-20260819T025100Z.json","caseId":"knot-hopf-rt","entries":{"completeness":17,"correctness":22,"score":39},"format":{"jsonValidity":4,"referenceIntegrity":6,"score":10},"goldRevision":"v1","graphComparison":{"candidate":{"entryCount":43,"inferenceCount":6,"isolatedEntryCount":29,"isolatedEntryIds":["paper:calculation:colored-jones","paper:calculation:colored-link-invariant","paper:calculation:jones-writhe-normalization","paper:calculation:kirby-sum","paper:calculation:rt-normalization","paper:def:blackboard-framing","paper:def:colored-ribbon-graph","paper:def:framing","paper:def:graphical-calculus","paper:def:handlebody","paper:def:hopf-monodial-dual","paper:def:kirby-color","paper:def:modular-category","paper:def:modular-data","paper:def:modular-hopf","paper:def:negligible-module","paper:def:ribbon-category","paper:def:signature","paper:def:strict-monoidal","paper:def:uqsl2-colors","paper:lemma:handle-slide","paper:proposition:rep-ribbon","paper:theorem:purification","paper:theorem:rt-invariant","paper:theorem:turaev-functor","paper:theorem:wrt-root-unity","paper:thm:kirby-calculus","paper:thm:lickorish-wallace","paper:thm:rohlin"],"isolatedEntryRatio":0.6744186046511628,"largestNontrivialComponentCoverage":0.18604651162790697,"largestNontrivialComponentSize":8,"nontrivialComponentCount":3},"gold":{"entryCount":37,"inferenceCount":19,"isolatedEntryCount":1,"isolatedEntryIds":["rt:entry:negligible-module"],"isolatedEntryRatio":0.02702702702702703,"largestNontrivialComponentCoverage":0.972972972972973,"largestNontrivialComponentSize":36,"nontrivialComponentCount":1}},"incorrectEntries":["paper:def:negligible-module：把“所有端同态的量子迹均为零”说成等价于仅有 tr_q(id_Z)=0；Gold 不支持这一等价性","B₀ 角色配置：误把 handle-slide lemma 和 WRT root-of-unity theorem 列入 B₀，并遗漏 Gold 的 Turaev purification theorem","paper:thm:rohlin：候选额外断言任意所界四维流形可要求仅由 B⁴ 附加 2-handles得到；Gold 中无此内容或逻辑角色"],"incorrectInferences":[],"inferences":{"completeness":5,"correctness":22,"score":27},"matchedEntries":["rt:entry:framed-link","rt:entry:surgery-manifold","rt:entry:lickorish-wallace","rt:entry:kirby-calculus","rt:entry:monoidal-category","rt:entry:braiding","rt:entry:duality","rt:entry:ribbon-category","rt:entry:graphical-calculus","rt:entry:turaev-ribbon-graph-functor","rt:entry:colored-link-invariant","rt:entry:quasitriangular-hopf-algebra","rt:entry:ribbon-hopf-algebra","rt:entry:coproduct-monoidal","rt:entry:antipode-duality","rt:entry:r-matrix-braiding","rt:entry:universal-twist","rt:entry:rep-ribbon","rt:entry:quantum-trace","rt:entry:finite-simple-system","rt:entry:hopf-link-matrix","rt:entry:modular-category","rt:entry:modular-hopf-algebra","rt:entry:turaev-purification-theorem","rt:entry:purified-category-modular","rt:entry:modular-data","rt:entry:kirby-color","rt:entry:handle-slide-invariance","rt:entry:signature-normalization","rt:entry:kirby-presentation-independence","rt:entry:rt-invariant"],"matchedInferences":["rt:inference:hopf-to-duality","rt:inference:r-matrix-to-braiding","rt:inference:rep-ribbon-to-qtrace"],"missingEntries":["rt:entry:kirby-reduction","rt:entry:hopf-algebra","rt:entry:twist","rt:entry:negligible-module（候选近似项含实质性错误）","rt:entry:purification","rt:entry:blowup-invariance"],"missingInferences":["rt:inference:geometry-to-kirby-reduction","rt:inference:organize-ribbon-category","rt:inference:organize-graphical-calculus","rt:inference:graphical-calculus-to-link-invariant","rt:inference:hopf-to-monoidal","rt:inference:ribbon-element-to-twist","rt:inference:assemble-rep-ribbon","rt:inference:organize-modular-category","rt:inference:apply-purification-theorem","rt:inference:organize-modular-data","rt:inference:organize-kirby-color","rt:inference:kirby-color-to-slide","rt:inference:organize-signature-normalization","rt:inference:normalization-cancels-blowup","rt:inference:kirby-moves-to-presentation-independence","rt:inference:presentation-independence-to-rt"],"promptVersion":"sol-score-prompt-v3","schema":"cmath.paper-import-sol-score/v3","scorer":"gpt-5.6-sol","solScore":76,"summary":"候选 JSON 与 Project View 可解析，所有 Entry、B₀、mainTarget 和 inference 引用均有效；它也覆盖了大多数核心对象和结论，尤其是 ribbon/表示范畴、modular data、Kirby color、归一化公式及最终 RT 不变量。不过，negligible module 中加入了不成立的等价说法，B₀ 逻辑角色配置有误，并缺少 Kirby 约化、独立的 purification 定义和归一化消除 ±1 move 等关键 Entry。最严重的问题是逻辑地图不完整：候选的 6 条 inference 主要集中于局部范畴与 Hopf 代数关系，几乎没有连接 modular category、Kirby color、handle-slide、blow-up normalization、presentation independence 与最终 RT theorem 的主证明链。结构指标与此语义判断一致：候选有 29/43 个孤立节点，最大非平凡分量仅覆盖 8/43，而 Gold 的主分量覆盖 36/37；这些数值仅作辅助证据，并非机械扣分依据。Gold 提供了 19 条覆盖主线的 inference，因此本案不存在因 Gold 推理结构过弱而无法充分比较的限制。","verdict":"needs-revision"}