{"candidateArtifact":"benchmarks/model-outputs/fixed-1.0/knot-hopf-rt-v3.26-20260818T095734Z.json","caseId":"knot-hopf-rt","entries":{"completeness":17,"correctness":24,"score":41},"format":{"jsonValidity":4,"referenceIntegrity":6,"score":10},"goldRevision":"v1","graphComparison":{"candidate":{"entryCount":44,"inferenceCount":4,"isolatedEntryCount":38,"isolatedEntryIds":["claim:mac-lane-coherence","claim:repfd-ribbon-category","claim:turaev-modular-hopf-purification","paper:calculation:Kirby-sum","paper:calculation:RT-normalization","paper:calculation:graphical-rules","paper:calculation:jones-writhe-normalization","paper:calculation:quantum-trace","paper:calculation:sl2-colors","paper:def:Kirby-color","paper:def:ML","paper:def:WL","paper:def:blackboard-framing","paper:def:categorical-trace","paper:def:colored-ribbon-graph","paper:def:duality","paper:def:framing","paper:def:hopf-braiding","paper:def:modular-category","paper:def:modular-data","paper:def:modular-hopf","paper:def:negligible-module","paper:def:quasitriangular","paper:def:ribbon-category","paper:def:ribbon-hopf","paper:def:signature","paper:def:strict-monoidal","paper:definition:colored-link-invariant","paper:definition:generic-Uq-colors","paper:lemma:handle-slide","paper:proposition:4.3","paper:theorem:3.6","paper:theorem:6.3","paper:theorem:7.3","paper:theorem:root-unity-wrt","paper:thm:2.1","paper:thm:2.2","paper:thm:2.3"],"isolatedEntryRatio":0.8636363636363636,"largestNontrivialComponentCoverage":0.06818181818181818,"largestNontrivialComponentSize":3,"nontrivialComponentCount":2},"gold":{"entryCount":37,"inferenceCount":19,"isolatedEntryCount":0,"isolatedEntryIds":[],"isolatedEntryRatio":0,"largestNontrivialComponentCoverage":1,"largestNontrivialComponentSize":37,"nontrivialComponentCount":1}},"incorrectEntries":["paper:def:negligible-module：把“所有端同态的量子迹均为零”称为等价于仅有 tr_q(id_Z)=0；一般而言后者并不足以推出前者","候选将 paper:proposition:4.3 与 claim:repfd-ribbon-category、paper:theorem:7.3 与 claim:turaev-modular-hopf-purification 分别重复提取，并把这些重复项同时列入 B₀"],"incorrectInferences":["paper:inference:organization:3：从 coproduct 给出的表示张量积直接连到 antipode 给出的对偶模，二者是 Hopf 结构的并列后果，而非候选所画的前者导出后者"],"inferences":{"completeness":3,"correctness":21,"score":24},"matchedEntries":["rt:entry:framed-link","rt:entry:surgery-manifold","rt:entry:lickorish-wallace","rt:entry:kirby-calculus","rt:entry:monoidal-category","rt:entry:braiding","rt:entry:duality","rt:entry:twist","rt:entry:ribbon-category","rt:entry:graphical-calculus","rt:entry:turaev-ribbon-graph-functor","rt:entry:colored-link-invariant","rt:entry:quasitriangular-hopf-algebra","rt:entry:ribbon-hopf-algebra","rt:entry:coproduct-monoidal","rt:entry:antipode-duality","rt:entry:r-matrix-braiding","rt:entry:universal-twist","rt:entry:rep-ribbon","rt:entry:quantum-trace","rt:entry:finite-simple-system","rt:entry:hopf-link-matrix","rt:entry:modular-category","rt:entry:negligible-module","rt:entry:modular-hopf-algebra","rt:entry:turaev-purification-theorem","rt:entry:purified-category-modular","rt:entry:modular-data","rt:entry:kirby-color","rt:entry:handle-slide-invariance","rt:entry:signature-normalization","rt:entry:rt-invariant"],"matchedInferences":["rt:inference:hopf-to-duality（由候选的 dual-module 定义与 A-线性证明共同覆盖）"],"missingEntries":["rt:entry:kirby-reduction","rt:entry:hopf-algebra","rt:entry:purification","rt:entry:blowup-invariance","rt:entry:kirby-presentation-independence"],"missingInferences":["rt:inference:geometry-to-kirby-reduction","rt:inference:organize-ribbon-category","rt:inference:organize-graphical-calculus","rt:inference:graphical-calculus-to-link-invariant","rt:inference:hopf-to-monoidal","rt:inference:r-matrix-to-braiding","rt:inference:ribbon-element-to-twist","rt:inference:assemble-rep-ribbon","rt:inference:rep-ribbon-to-qtrace","rt:inference:organize-modular-category","rt:inference:apply-purification-theorem","rt:inference:organize-modular-data","rt:inference:organize-kirby-color","rt:inference:kirby-color-to-slide","rt:inference:organize-signature-normalization","rt:inference:normalization-cancels-blowup","rt:inference:kirby-moves-to-presentation-independence","rt:inference:presentation-independence-to-rt"],"promptVersion":"sol-score-prompt-v3","schema":"cmath.paper-import-sol-score/v3","scorer":"gpt-5.6-sol","solScore":75,"summary":"候选 JSON 与内嵌 Project View 可解析，主要 ID 引用有效，mainTarget 也正确指向 RT 不变量。Entry 覆盖较强：surgery/Kirby 演算、ribbon 范畴、Ribbon Hopf 表示、模数据、Kirby color、归一化及最终 RT 定理基本齐全，部分 Gold 的细分定义被候选合理合并。不过候选遗漏若干关键中间角色，并对 negligible module 给出了不成立的一般等价说法，且存在重复定理/B₀ 项。最严重的问题是逻辑地图：Gold 用 19 条 inference 把全部 37 个 Entry 连成一条完整的几何—范畴—Hopf—模数据—Kirby 不变性—RT 不变量链，而候选仅有 4 条局部推理，其中只有 Hopf 对偶线性证明实质覆盖 Gold 关系；handle-slide、blow-up 抵消、Kirby presentation independence 到主定理等核心推导全部未连接。候选 38/44 个 Entry 孤立、最大非平凡分支仅覆盖 3/44，印证其更像条目清单而非数学推理地图。这里不能把定义天然独立一概视为错误，但如此大规模孤立与核心链条缺失具有明确语义后果；相较之下 Gold 的 19 条推理和全连通结构提供了充分的组织逻辑对照。","verdict":"needs-revision"}